,url,title,description,category,location,project_id
1789,https://www.kickstarter.com/projects/kingsarmhk/propeller-a-reinvented-watch-winder-by-kings-arm?ref=discovery_popular,Propeller | A Reinvented Watch Winder by King's Arm,Grand Display of Prosperity,Product Design,"Hong Kong, Hong Kong",116746378
1790,https://www.kickstarter.com/projects/meandmybigmove/me-and-my-big-move-workbook?ref=discovery_popular,Me and My Big Move workbook,To empower kids for a Big Move,Children's Books,"Seattle, WA",597111322
1791,https://www.kickstarter.com/projects/arkosolutions/luftguardtm-hands-free-sprayer-and-dispenser-0?ref=discovery_popular,LuftGuard™ | Hands-Free Sprayer and Dispenser,Promoting cleanliness at the tip of your fingers,Design,"Central, Hong Kong",1720077231
1792,https://www.kickstarter.com/projects/peaceofheartchoir/new-york-sings-along-and-beyond?ref=discovery_popular,New York Sings Along & Beyond,"Support the work of Peace of Heart Choir, a volunteer group of 50 singers in NYC who bring joy to those in need. We need your help!",World Music,"New York, NY",1893549506
1793,https://www.kickstarter.com/projects/tokyoxlstreet/tokyo-fashion-and-street-zine-magazine?ref=discovery_popular,Tokyo Fashion & Street Zine Magazine,A bi-monthly(2months) Tokyo Fashion & Street Zine Magazine. ２ヶ月後の東京ファッション＆ストリートZINE誌。,Photobooks,"Tokyo, Japan",2131992465
1794,https://www.kickstarter.com/projects/navidfrahman/havenfall-a-graphic-novel-set-on-a-distant-planet?ref=discovery_popular,"""Havenfall"" - a graphic novel set on a distant planet","An action/adventure graphic novel by Navid F Rahman and Fahim Md Mahfuzur Rahman, highlighting a father's efforts to cure his daughter",Graphic Novels,"Toronto, Canada",1228801370
1795,https://www.kickstarter.com/projects/ccolourdrunkk/hair-noir-speaking-through-styles?ref=discovery_popular,Hair Noir: Speaking through styles,"A series of interdisciplinary events on Black British culture, using film screenings, panel discussions and art to curate unique spaces",Social Practice,"London, UK",716035594
1796,https://www.kickstarter.com/projects/cammino20/luxury-italian-sneaker-launch-melbourne-designer?ref=discovery_popular,Luxury Italian Sneaker Launch - Melbourne Designer,Luxury Sneakers Handmade In Italy - by Cammino Shoes,Footwear,"Melbourne, AU",635645158
1797,https://www.kickstarter.com/projects/bobhillmanmusic/inside-and-terrified?ref=discovery_popular,Inside & Terrified,Five songs written and recorded during the COVID-19 lockdown,Country & Folk,"San Francisco, CA",289139054
1798,https://www.kickstarter.com/projects/371550011/timibot?ref=discovery_popular,TimiBot,"Easy-to-use robotic toy for children, the new way to learn robotics, programming with Arduino and STEM",Robots,"Mexico City, Mexico",1090281681
1799,https://www.kickstarter.com/projects/tankitha/fire-and-spirit?ref=discovery_popular,Fire and Spirit,"18""x24"" posters and prints",Illustration,"Mesa, AZ",413036911
1800,https://www.kickstarter.com/projects/subplotrecordings/hardfloor-david-harness-jeffrey-tice-zack-meads-12-vinyl?ref=discovery_popular,"Hardfloor, David Harness, Jeffrey Tice, Zack Meads 12"" Vinyl","12"" Vinyl Release With Hardfloor, David Harness, and Jeffrey Tice Remixing Zack Meads' ""In Awe""",Electronic Music,"San Francisco, CA",1418165288
1801,https://www.kickstarter.com/projects/timboyle/great-white-zeke?ref=discovery_popular,Great White Zeke,Children's Picture Book,Children's Books,"Mesa, AZ",681004125
1802,https://www.kickstarter.com/projects/clocktowerpizza/clock-tower-pizza-a-back-to-the-future-themed-restaurant?ref=discovery_popular,Clock Tower Pizza - a Back To The Future Themed Restaurant,"We are creating a fun experience that brings you back to 1985, 1955, 2015 or even 1885! See our nostalgia and try our tasty pizza!!!!",Restaurants,"Lake Geneva, WI",140813252
1803,https://www.kickstarter.com/projects/1543392864/pro-wrestling-comic-series-championship-wrestling-league-1?ref=discovery_popular,Pro Wrestling Comic Series-Championship Wrestling League #1,"A professional wrestling based comic book series by Mike Speer, Mac Radwonski and Ichsan Ansori.",Comic Books,"Hardyston, NJ",2106908934
1804,https://www.kickstarter.com/projects/ecke/pandemia-the-origin-of-coronavirus?ref=discovery_popular,Pandemia. The Origin of Coronavirus,Pandemia is a book which offers the reader a new and radical point of view of where might be the origin of new virus: Aliens,Fiction,"Mexico, Mexico",1601229869
1805,https://www.kickstarter.com/projects/gpcamejo/pandora-irrigation-plant-watering-re-imagined?ref=discovery_popular,Pandora Irrigation: Plant Watering Re-Imagined,"A WiFi controlled, smart plant watering device. Allows you to remotely water your indoor plants from anywhere in the world!",Hardware,"Coral Springs, FL",649798619
1806,https://www.kickstarter.com/projects/quoffensive/quoffensive-combatting-telemarketing-fraud-realtime?ref=discovery_popular,QuOffensive: Combatting telemarketing fraud realtime.,QuOffensive is an application that will make an offensive stance against telemarketing fraud. Time to fight back!,Apps,"Three Rivers, MI",1829006244
1807,https://www.kickstarter.com/projects/95251542/chameleon-adventures-personalized-kids-book?ref=discovery_popular,Chameleon Adventures (personalized kids book),A personalized childrens book (5-8 years old) in which they star in the book and learn. A very special gift.,Children's Books,"Madrid, Spain",1487159449
1808,https://www.kickstarter.com/projects/bigfootgame/bigfoot-the-board-game?ref=discovery_popular,Bigfoot the Board Game,Bigfoot is a board game that combines entertainment and environmental awareness :),Tabletop Games,"Zwolle, Netherlands",270911826
1809,https://www.kickstarter.com/projects/252091285/we-are-the-drops?ref=discovery_popular,We Are The Drops,The only application for environmental protection where you can share your action with your friends and measure its value day-to-day,Apps,"France, France",2089094287
1810,https://www.kickstarter.com/projects/chemarod/leyendas-de-crod?ref=discovery_popular,Leyendas De Crod,"Libro de fantasía, acción, amistad, terror y drama, ¿Has pensado como sería estar en un mundo de fantasía?",Fiction,"Colima, Mexico",1086180677
1811,https://www.kickstarter.com/projects/eternalverse/magic-the-gathering-shapeshifter-token?ref=discovery_popular,Magic The Gathering - Shapeshifter Token,A Swiss army knife for your deck: a token holder and a generator for the tabletop game MTG with endless customizable options.,Gaming Hardware,"Vigo, Spain",1567226167
1812,https://www.kickstarter.com/projects/1551526812/treebot-earths-last-living-tree?ref=discovery_popular,TreeBot: Earth's Last Living Tree,A story about Earth's last living tree's fight for survival and his journey toward making the planet green once again.,Comic Books,"San Marcos, TX",727570515
1813,https://www.kickstarter.com/projects/pridefrogpin/pride-month-froggy-pin?ref=discovery_popular,Pride Month Froggy Pin,"Cute pride froggy pin! In celebration of pride month, we have created a loving little frog you can display anywhere.",Mixed Media,"Dallas, TX",1427996379
1814,https://www.kickstarter.com/projects/acstnyc/a-safe-harbor-for-our-acst-mothership?ref=discovery_popular,A Safe Harbor for our ACST Mothership,Help bring winds to our sails and break this slumber. Be our lighthouse in this storm so that our Mothership isn't torn asunder.,Painting,"New York, NY",1282485262
1815,https://www.kickstarter.com/projects/talesofhorror/tales-of-horror-and-mystery?ref=discovery_popular,Tales of Horror and Mystery,"We are creating an anthology horror book with scary stories and full page, bone chilling art.",Anthologies,"Barberton, OH",1256752411
1816,https://www.kickstarter.com/projects/pregamecoffee/pregame-your-day-with-pregame-coffee?ref=discovery_popular,Pregame Your Day with Pregame Coffee,Louisville's ONLY sports-centered coffee shop,Restaurants,"Louisville, KY",1959141707
1817,https://www.kickstarter.com/projects/sayhome/stay-home-ceramics-save-a-plate?ref=discovery_popular,STAY HOME Ceramics- Save a Plate,Help us ride through COVID19 by supporting us as we stay home & paint all our cafe's plates into art pieces.,Ceramics,"Singapore, Singapore",1860316389
1818,https://www.kickstarter.com/projects/upstatehandmade/upstate-handmade?ref=discovery_popular,Upstate Handmade,This kickstarter will provide funding for marketing and a SEO campaign. I design and hand make luxury leather wallets and watch bands,Art,"Los Angeles, CA",224689971
1819,https://www.kickstarter.com/projects/yampos/yampos-point-of-sale-system-for-ios-android?ref=discovery_popular,YAMPOS - Point of sale system for IOS/ANDROID,This solution is allows you to automate your beauty business. Yampos is a cloud-based beauty POS/CRM system.,Software,"Kiev, Ukraine",1868815478
1820,https://www.kickstarter.com/projects/tftb/farms-of-gettysburg?ref=discovery_popular,Farms of Gettysburg,Highly detailed laser cut building kits for 28mm and 15mm miniatures,Tabletop Games,"Fairfield, CT",1778193407
1821,https://www.kickstarter.com/projects/pjlger/project-limitless?ref=discovery_popular,Project Limitless,"""Create your own Story""",Video Games,"Deutsch, Germany",2063219262
1822,https://www.kickstarter.com/projects/gregroller/detta-dine-better?ref=discovery_popular,Detta. Dine Better.,"A mobile app for a safe, paper-less dining experience.",Apps,"Fremont, CA",1916890985
1823,https://www.kickstarter.com/projects/bauerturningworks/strike-safe-navigate-your-world-safely?ref=discovery_popular,STRIKE SAFE - Navigate your world safely.,"Made from antimicrobial copper, feel at ease when pressing, pulling, and pushing in public. Add it to your keys or pocket!",Product Design,"Lonsdale, MN",1077380844
1824,https://www.kickstarter.com/projects/yampos/yampos-point-of-sale-system-for-ios-android?ref=discovery_popular,YAMPOS - Point of sale system for IOS/ANDROID,This solution is allows you to automate your beauty business. Yampos is a cloud-based beauty POS/CRM system.,Software,"Kiev, Ukraine",1868815478
1825,https://www.kickstarter.com/projects/zelphacomics/beautiful-canada-3d-handmade-multilayered-poster-booklets?ref=discovery_popular,Beautiful Canada: 3D Handmade Multilayered Poster Booklets,A series of handmade 3D multilayered cardboard collages featuring all the provinces and territories of Canada,Printing,"Mississauga, Canada",1026290616
1826,https://www.kickstarter.com/projects/resslerart/blood-destined-lovers-enamel-pin?ref=discovery_popular,Blood+ Destined lovers anime enamel pin,Creating an enamel pin to pay homage to one of my all time favorite anime Blood+,Art,"Portland, OR",1203592584
1827,https://www.kickstarter.com/projects/onemillionframes/the-one-million-frames-project-show-your-passion?ref=discovery_popular,The One Million Frames Project - Show your passion,"Ein Film mit exakt einer Million Frames, der jedem ermöglicht, seine Passion der Öffentlichkeit zu zeigen.",Experimental,"Stuttgart, Germany",1140654239
1828,https://www.kickstarter.com/projects/stage2studios/stage-2-studios-a-decade-of-bath-music?ref=discovery_popular,Stage 2 Studios - A Decade of Bath Music,"A celebration of the music created at Stage 2 Studios (Bath), raising money for our great freelance and self employed personnel.",Music,"Bath, UK",1069172923
1829,https://www.kickstarter.com/projects/cellpuzzles1/organic-enigmas-plant-and-animal-cell-wooden-jigsaw-puzzles?ref=discovery_popular,Organic Enigmas. Plant and Animal cell wooden jigsaw puzzles,A new kind of jigsaw puzzle,Puzzles,"Charleston, SC",1935625530
1830,https://www.kickstarter.com/projects/skylar83/spring-loaded-centering-tool-aka-the-third-hand?ref=discovery_popular,"Spring loaded centering tool, aka “the third hand”",A handy tool for manufacturing,Design,"Kitchener, Canada",95376257
1831,https://www.kickstarter.com/projects/positivelydeadly/tarot-enamel-pin-collection?ref=discovery_popular,Tarot Enamel Pin Collection,We have designed several tarot-based pins and plan to start a collection.,Art,"Lethbridge, Canada",1106928160
1832,https://www.kickstarter.com/projects/everingroad/evering-road-people?ref=discovery_popular,Evering Road People,"In a time of lockdown where we've all been asked to stay at home, I turned the camera on my own street. This is Evering Road, Hackney.",Photobooks,"London, UK",2093304147
1833,https://www.kickstarter.com/projects/helloro/nice-pops?ref=discovery_popular,Nice Pops,Plant based frozen cream pops,Vegan,"Los Angeles, CA",1711706225
1834,https://www.kickstarter.com/projects/mrmeyer/sxxy-isabell-art-nude-photobook?ref=discovery_popular,Sxxy Isabell - Art Nude Photobook,Art Nude Shots of sxxy German girl Isabell,Fine Art,"Leipzig, Germany",1709847827
1835,https://www.kickstarter.com/projects/push-n-play/pushnplayonline-play-music-together-over-internet?ref=discovery_popular,Push'n'Play.online — play music together over the Internet!,"This device enables your band's online rehearsal in seconds. Just plug in your guitar and mic, push the button and enjoy the music!",Sound,"Moscow, Russia",48233374
1836,https://www.kickstarter.com/projects/romanebourgeois/regarde-ou-tu-mets-les-pieds?ref=discovery_popular,Regarde où tu mets les pieds,Walking and photographing the Adriatic Coast after COVID-19 emergency.,Places,"Otranto, Italy",1702475713
1837,https://www.kickstarter.com/projects/jobcentrerejects/jobcentre-rejects-vol-3-and-vol-4-limited-colored-vinyl?ref=discovery_popular,Jobcentre Rejects Vol 3 and Vol 4 limited colored vinyl,Two volumes of Jobcentre Rejects. Deluxe compilation albums of rare NWOBHM and FWOSHM (First Wave OF Swedish Heavy Metal) records.,Metal,"Gothenburg, Sweden",1310720020
1838,https://www.kickstarter.com/projects/sharoncherryballard/just-believe?ref=discovery_popular,Just Believe,A short animated film inspired by the lack of BAME representation in the ballet world.,Animation,"London, UK",86804119
1839,https://www.kickstarter.com/projects/dimitrov/kill-covid?ref=discovery_popular,KILL COVID,Get ready for your journey to the vaccine that will save us and KILL COVID.,Tabletop Games,"Berne, Switzerland",1096806317
1840,https://www.kickstarter.com/projects/fjimenez/turbosandals-the-electric-motorised-sandals?ref=discovery_popular,TURBOSANDALS - THE ELECTRIC MOTORISED SANDALS,The Sandals that runs in the water | Fast and Fun |,Technology,"Cartagena, Spain",2068213043
1841,https://www.kickstarter.com/projects/mrmeyer/sxxy-isabell-art-nude-photobook?ref=discovery_popular,Sxxy Isabell - Art Nude Photobook,Art Nude Shots of sxxy German girl Isabell,Fine Art,"Leipzig, Germany",1709847827
1842,https://www.kickstarter.com/projects/playdeadpictures/scrotum-the-second-one?ref=discovery_popular,Scrotum: The Second One,Here we go again.,Horror,"Bristol, VA",116343860
1843,https://www.kickstarter.com/projects/push-n-play/pushnplayonline-play-music-together-over-internet?ref=discovery_popular,Push'n'Play.online — play music together over the Internet!,"This device enables your band's online rehearsal in seconds. Just plug in your guitar and mic, push the button and enjoy the music!",Sound,"Moscow, Russia",48233374
1844,https://www.kickstarter.com/projects/hfsmusic/hfs-vol-2?ref=discovery_popular,HFS Vol. 2,Proyecto de música personal (artista independiente),Music,"S. Luis Potosi, Mexico",923225723
1845,https://www.kickstarter.com/projects/blissful/blissful?ref=discovery_popular,BLISSFUL,"Depression, Anxiety & Stress Relief game app based on Visuals,Sounds,Musics,Mindfulness and Comfortable controls.",Mobile Games,"Tokyo, Japan",290720159
1846,https://www.kickstarter.com/projects/silkissed/silkissed-the-beauty-pillowcase?ref=discovery_popular,Silkissed: The Beauty Pillowcase,Handcrafted Mulberry Silk Pillowcase,Crafts,"London, UK",1660856186
1847,https://www.kickstarter.com/projects/dimensionzero/dimension-zero-a-sci-fi-comics-zine?ref=discovery_popular,Dimension Zero | A Sci-Fi Comics Zine,1st Star-Born issue. Collecting fragments from other dimensions of what's real...,Comic Books,"Greenfield, MA",247295687
1848,https://www.kickstarter.com/projects/icestory/slimeys-story?ref=discovery_popular,Slimey's Story,Slimey Story is a Game I've been working on for over a year. It's a Timed Puzzel Platformer! Try the Demo!,Video Games,"Bensalem, PA",1202193929
1849,https://www.kickstarter.com/projects/timothypstudios/make-100-limited-edition-art-print-of-legendary-land-rover?ref=discovery_popular,MAKE 100 Limited Edition Art Print of Legendary Land Rover,MAKE 100 pc. limited edition Reduction Print Linocut of the classic Land Rover Series,Painting,"Ormskirk, UK",25967564
1850,https://www.kickstarter.com/projects/goodforgames/gamer-cat-pin-set?ref=discovery_popular,Gamer Cat Pin Set,Iconic Cat Headphones used by all the Cutie Patooties and their Alter-Egos,Accessories,"Rancho Cucamonga, CA",474785000
1851,https://www.kickstarter.com/projects/jocelynmathewes/women-with-icons?ref=discovery_popular,Women With Icons,A series of portraits of Eastern Orthodox Christian women with icons of their patron saints -- now a limited edition book.,People,"Johnson City, TN",1473902092
1852,https://www.kickstarter.com/projects/unso/kopfhorer-wie-ein-fingerabdruck?ref=discovery_popular,Kopfhörer wie ein Fingerabdruck,"Maßgefertigte Kopfhörer, die speziell auf die Anatomie abgestimmt sind.",Music,"Hannover, ND",1218566711
1853,https://www.kickstarter.com/projects/essencielswitzerland/essenciel-switzerland-treewatches?ref=discovery_popular,Essenciel Switzerland Treewatches,Nous voulons créer des liens entre le monde digital et la nature. Nous plantons votre arbre lorsque vous achetez une montre chez nous.,Hardware,"Suisse, France",1188600594
1854,https://www.kickstarter.com/projects/ritcreations/rise-in-time-fantasy-strategy-mmo?ref=discovery_popular,Rise in Time: Fantasy Strategy MMO,"A competitive real-time strategy multiplayer game, different from what you've seen before. Built by MMORTS enthusiasts.",Video Games,"Zurich, Switzerland",2131492735
1855,https://www.kickstarter.com/projects/kojo-paraplus/75230188?ref=discovery_popular,パラスポーツチャリティプロジェクト,『覚悟』をテーマとする武人画師“こうじょう雅之”が、『パラアスリート』を『武人画』として描き、その『パラ武人画』を通じて競技団体へチャリティを行うためのプロジェクトです。,Art,"Tokyo, Japan",75230188
1856,https://www.kickstarter.com/projects/110429675/double-dice-off?ref=discovery_popular,DOUBLE DICE OFF!,"Fast-Paced Entertainment! Play a Challenge, Pass a Challenge! Before you know it you will be shouting out “1..2..3..DOUBLE DICE OFF!”",Tabletop Games,"Poughkeepsie, NY",1927233758
1857,https://www.kickstarter.com/projects/elayna/darkness-undone?ref=discovery_popular,Darkness Undone,The conclusion of the Unveil Me poetry duology.,Poetry,"Philadelphia, PA",1628223638
1858,https://www.kickstarter.com/projects/r3vira-frames/enmarcando-el-futuro-renovando-historias?ref=discovery_popular,"FRAME the future, ENMARCANDO el futuro","One frame, one story. Each one, a sustentable step together. Un marco, una historia. Cada historia, un paso sustentable.",Social Practice,"Mexico City, Mexico",814688984
1859,https://www.kickstarter.com/projects/diasporanewyork/diaspora-new-york-collection?ref=discovery_popular,Diaspora New York Collection,To create a collection of beautiful designs in vibrant African prints. Diaspora bridges the gap between traditional and modern.,Apparel,"New York, NY",1124740547
1860,https://www.kickstarter.com/projects/r3vira-frames/enmarcando-el-futuro-renovando-historias?ref=discovery_popular,"FRAME the future, ENMARCANDO el futuro","One frame, one story. Each one, a sustentable step together. Un marco, una historia. Cada historia, un paso sustentable.",Social Practice,"Mexico City, Mexico",814688984
1861,https://www.kickstarter.com/projects/lespetitsfelix/les-petits-felix-mindful-wooden-toys?ref=discovery_popular,Les Petits Felix - Mindful Wooden Toys,All our handcrafted wooden toys come with mindfulness games that help children build emotional superpowers.,Games,"Llandrindod Wells, UK",1057434209
1862,https://www.kickstarter.com/projects/jennybow/jenny-bow-agility-for-beginers-and-elite?ref=discovery_popular,JENNY Bow agility- For beginners and elite,We want to share with the world a durable slalom guide for everyone that wants to teach their dog agility basics.,Product Design,"Gothenburg, Sweden",159791284
1863,https://www.kickstarter.com/projects/maisonenplumes/maison-en-pieces?ref=discovery_popular,Maison En Pieces?,"Jigsaw puzzles showcasing chickens, landscapes and wildlife from the Central Florida portfolio of Maison En Plumes.",Puzzles,"Sanford, FL",1307941526
1864,https://www.kickstarter.com/projects/diasporanewyork/diaspora-new-york-collection?ref=discovery_popular,Diaspora New York Collection,To create a collection of beautiful designs in vibrant African prints. Diaspora bridges the gap between traditional and modern.,Apparel,"New York, NY",1124740547
1865,https://www.kickstarter.com/projects/miketaylorcartoons/pin?ref=discovery_popular,PIN - The Comic,A fun short story following Pin on a Sci-Fi adventure,Comic Books,"Manchester, UK",1982685881
1866,https://www.kickstarter.com/projects/will82rob/pan?ref=discovery_popular,PAN,A micro-budget folk horror short film.,Horror,"Conwy, UK",1663228788
1867,https://www.kickstarter.com/projects/883888001/last-drop-llc?ref=discovery_popular,"Last Drop, LLC",A steampunk themed coffee shop and gluten free bakery,Restaurants,"Copperas Cove, TX",2104693594
1868,https://www.kickstarter.com/projects/debbiedoodles/the-golden-fairy-and-friends?ref=discovery_popular,The Golden fairy and friends,"A preschool rhyming children's book introducing the activity of rock painting in a fun way with loveable, memorable characters.",Children's Books,"Leicestershire, UK",356193771
1869,https://www.kickstarter.com/projects/heroesofspace/heroes-of-space-first-contact?ref=discovery_popular,Heroes of Space | First Contact,A series of limited edition fine art prints with three motives from an imaginary space-faring future.,Illustration,"Basel, Switzerland",1634990327
1870,https://www.kickstarter.com/projects/isocialize/isocializeme-the-future-of-social?ref=discovery_popular,iSocialize.me The future of social networking,A Social Network,Web,"Shibuya-ku, Japan",573711338
1871,https://www.kickstarter.com/projects/gensheersartschool/online-watercolor-painting-courses?ref=discovery_popular,Online Watercolor Painting Courses,Learn to paint watercolor paintings online step by step from the comfort of your own home.,Painting,"Mansfield, TX",1304294829
1872,https://www.kickstarter.com/projects/americanindiancards/new-portraits-of-the-american-indian-playing-cards?ref=discovery_popular,New Portraits of the American Indian Playing Cards,A Playing Card Deck Based on a New Vision of American Indians from the Imagination of Artist & Painter Jean Bradley,Playing Cards,"Alexandria, VA",149634213
1873,https://www.kickstarter.com/projects/wtfp/grey-and-clay?ref=discovery_popular,GREY & CLAY: Pottery Classes for the elderly,Help to reduce the effects of social isolation and grief for Medway's elderly community.,Ceramics,"Chatham, UK",1353323622
1874,https://www.kickstarter.com/projects/barockychocky/hydrofoils-of-sydney?ref=discovery_popular,Hydrofoils of Sydney,A digital print celebrating the eight hydrofoils that served Sydney.,Illustration,"Sydney, AU",1482719496
1875,https://www.kickstarter.com/projects/thesapience/thesapiencecom-mastery-and-love-of-math-for-all?ref=discovery_popular,TheSapience.com - Mastery & Love Of Math For All,Let's help the world love and master math through our proven mental math curriculum by merging into a gamified application for all.,Apps,"Las Vegas, NV",1112244483
1876,https://www.kickstarter.com/projects/thefrogboard/the-frogboard?ref=discovery_popular,The Frogboard,Ride All Day,Product Design,"Austin, TX",919693934
1877,https://www.kickstarter.com/projects/kellyasmusalbornoz/beautiful-east-gippsland-photobook-by-kelly-asmus-albornoz?ref=discovery_popular,"Beautiful East Gippsland, Photobook by Kelly Asmus Albornoz","Come on a photographic tour of Beautiful East Gippsland with local photographer Kelly Asmus Albornoz, all from the comfort of home.",Photobooks,"Bairnsdale, AU",280545512
1878,https://www.kickstarter.com/projects/reduxsociety/redux-society-kansas-citys-social-entertainment-bookstore?ref=discovery_popular,Redux Society: Kansas City's Social Entertainment Bookstore,"A new kind of bookstore that provides social entertainment in the form of dance, lightsaber, crafting, and more!",Interactive Design,"Kansas City, MO",1767937912
1879,https://www.kickstarter.com/projects/florianmartens/affordable-ergonomic-seating-even-if-youre-tall?ref=discovery_popular,Affordable ergonomic seating - even if you're tall,Extra-large wheels to add three inches to your existing chair,Product Design,"Berlin, Germany",1965432202
1880,https://www.kickstarter.com/projects/borntwice/born-twice-fighting-a-virus-and-death-memories-of-a-coma?ref=discovery_popular,"BORN TWICE - fighting a virus and Death, memories of a coma","The story of my fight against Death, when I came out quadriplegic from a 2-week unexpected coma from which I keep all the memories.",Nonfiction,"Paris, France",452233804
1881,https://www.kickstarter.com/projects/360bikelights/360-bike-lights-designed-using-bike-safety-research?ref=discovery_popular,360 bike lights - designed using bike safety research.,Bike lights to help you be seen,Gadgets,"London, UK",486731655
