,url,title,description,category,location,project_id
1116,https://www.kickstarter.com/projects/slydehandboards/gotcha-the-return-of-californias-original-surf-icon?ref=discovery_popular,Gotcha: The Return of California's Original Surf Icon,Rebuilding 80's/90's Pop Culture Legend: Gotcha,Product Design,"San Clemente, CA",1354408439
1117,https://www.kickstarter.com/projects/thrashers/chromosome-21-comics-presents-thrashers?ref=discovery_popular,Chromosome 21 Comics Presents Thrashers,Thrashers is a Sci-Metal-Fi Retro Comic Books series,Comic Books,"Benbrook, TX",2126189774
1118,https://www.kickstarter.com/projects/hyperversecomics/nothing-man-5-second-chance-campaign?ref=discovery_popular,Nothing-man #5 - SECOND CHANCE CAMPAIGN!!!,"Supremous becomes even more powerful, Chaotika is off the hook, and Nothing-man finally remembers everything!!! 2nd chance campaign!",Comic Books,"Virginia Beach, VA",1619795821
1119,https://www.kickstarter.com/projects/fency/fency-optimize-your-desk-usability?ref=discovery_popular,Fency: Optimize Your Desk Usability,"A specially designed fence that allows you to make full use of your desk, by preventing things from falling off the edges.",Product Design,"San Francisco, CA",1854566179
1120,https://www.kickstarter.com/projects/decoding-disruption/only-on-kickstarter-the-decoding-disruption?ref=discovery_popular,(v1.0) DECODING DISRUPTION by Naully Nicolas,A 400-page exclusive book + a backer-only community for new and experienced digital leaders.,Nonfiction,"Geneva, Switzerland",772351921
1121,https://www.kickstarter.com/projects/badashedesign/2020-getaway-pins?ref=discovery_popular,2020 Getaway pins,"Quarantine has trapped us in our homes, so ACNH has been our virtual getaway! I want to make pins to express our shared 2020 vacation.",Illustration,"Atlanta, GA",111377725
1122,https://www.kickstarter.com/projects/gliders/gliders-cardistry-packets?ref=discovery_popular,Gliders Cardistry Packets,Handmade resin cardistry trainers with a variety of designs to choose from,Playing Cards,"Dallas, TX",1437370753
1123,https://www.kickstarter.com/projects/shooglenifty/shoogleniftys-9th-studio-album?ref=discovery_popular,Shooglenifty's 9th studio album,"Introducing Acid Croft Vol 9, our first album to feature the dynamic Eilidh Shaw on fiddle",Music,"Edinburgh, UK",1359345463
1124,https://www.kickstarter.com/projects/whelon/search-and-find-jigsaw-puzzles?ref=discovery_popular,Search-and-Find Jigsaw Puzzles,"Do the jigsaws, find the characters.",Puzzles,"San Francisco, CA",1019718862
1125,https://www.kickstarter.com/projects/jkballantyne/animalinyou?ref=discovery_popular,Animal in You: what do you see in your inkblot?,A series of paintings inspired by your interpretation of an inkblot: Tell me what you see and I'll bring your vision to life with paint,Painting,"London, UK",2011020210
1126,https://www.kickstarter.com/projects/52cats/ezine-52-katzen-52-cats?ref=discovery_popular,Ezine 52 Katzen / 52 Cats,Katzen-Persönlichkeiten stellen sich vor / Cat characters introduce themselves,Publishing,"Haselünne, Germany",105638581
1127,https://www.kickstarter.com/projects/dawsonvelma/timeless-hand-made-luxury-dawson-velma-watches-and-accessories?ref=discovery_popular,TIMELESS HAND MADE LUXURY DAWSON VELMA WATCHES & ACCESSORIES,Carbon Neutral - New Zealand designed luxury watches / Our designs are Swiss & Japanese mechanical movements - 100% HM -dawsonvelma.com,Product Design,"Auckland, NZ",505715394
1128,https://www.kickstarter.com/projects/777861661/wild-pups-pet-goods?ref=discovery_popular,Wild Pups Pet Goods,"High Quality, Trendy Pet Accessories",Product Design,"Singapore, Singapore",1895189751
1129,https://www.kickstarter.com/projects/1327314385/barbaric-splendor-kickstarter-two-personalities-2?ref=discovery_popular,Barbaric Splendor Kickstarter Two: Personalities 2,Barbaric Splendor Miniatures is expanding its line of licensed miniatures with authors and artists of heroic swords and sorcery!,Tabletop Games,"Lafayette, CA",184091742
1130,https://www.kickstarter.com/projects/abigailstarling/she-ra-large-catradora-enamel-pin?ref=discovery_popular,She-Ra Large Catradora Enamel Pin,Commemorative layered enamel pin with Adora and Catra framed by the Heart of Etheria.,Art,"Seattle, WA",321197912
1131,https://www.kickstarter.com/projects/dawsonvelma/timeless-hand-made-luxury-dawson-velma-watches-and-accessories?ref=discovery_popular,TIMELESS HAND MADE LUXURY DAWSON VELMA WATCHES & ACCESSORIES,Carbon Neutral - New Zealand designed luxury watches / Our designs are Swiss & Japanese mechanical movements - 100% HM -dawsonvelma.com,Product Design,"Auckland, NZ",505715394
1132,https://www.kickstarter.com/projects/saucestream/the-saucestream-squeezer?ref=discovery_popular,The Saucestream Squeezer,The squeezer is an eco-friendly plastic-free product that brings the squeezy convenience of plastic sauce bottles to the glass option.,Product Design,"Birmingham, UK",1870420583
1133,https://www.kickstarter.com/projects/615903974/questions-to-europe-a-children-s-book?ref=discovery_popular,Questions to Europe – A Children’s Book,An illustrated book for children from the age of 6 about Europe and the EU.,Children's Books,"Wurzburg, Germany",1328616540
1134,https://www.kickstarter.com/projects/vailimaprayers/the-windmill-needs-the-wind-stevenson-in-samoa?ref=discovery_popular,The Windmill Needs The Wind: Stevenson in Samoa,"From Robert Louis Stevenson's original prayers: 12 songs to provide meaning in dark days, and make your heart sing in good times.",Country & Folk,"Ballarat, AU",1502917136
1135,https://www.kickstarter.com/projects/zzltech/nirvana-project-8-speed-transmission-rc-car?ref=discovery_popular,Nirvana Project-8-speed transmission RC car,"An RC car with a 8-speed transmission, brakes, independent suspension, differential, all to make it mechanically closer to real cars.",3D Printing,"Montreal, Canada",281550824
1136,https://www.kickstarter.com/projects/517417439/norse-runes-tyrs-aett?ref=discovery_popular,Norse Runes: Tyr's Aett,Enamel pins based off the Old Norse runes.,Art,"Charlotte, NC",997566554
1137,https://www.kickstarter.com/projects/badconscience/queer-techno-ep-bad-conscience-insecure?ref=discovery_popular,Queer Techno EP: Bad Conscience - Insecure,Pre-orders will fund mixing and mastering and a promo campaign to reach more listeners,Music,"Berlin, Germany",747357698
1138,https://www.kickstarter.com/projects/gokurakuya/zen-dice-made-by-makers-of-buddhist-altars?ref=discovery_popular,ZEN-DICE made by makers of Buddhist Altars,ZEN-DICE are made with the same skills that carve Buddha statues,Tabletop Games,"Kakogawa-shi, Japan",21084338
1139,https://www.kickstarter.com/projects/cornelius-grace/contain-the-flame-uk-made?ref=discovery_popular,💡 Eco-FireStarters 💡,Eco-friendly handmade selection of FireStarters!,Product Design,"Weedon, UK",1836335569
1140,https://www.kickstarter.com/projects/gokurakuya/zen-dice-made-by-makers-of-buddhist-altars?ref=discovery_popular,ZEN-DICE made by makers of Buddhist Altars,ZEN-DICE are made with the same skills that carve Buddha statues,Tabletop Games,"Kakogawa-shi, Japan",21084338
1141,https://www.kickstarter.com/projects/cornelius-grace/contain-the-flame-uk-made?ref=discovery_popular,💡 Eco-FireStarters 💡,Eco-friendly handmade selection of FireStarters!,Product Design,"Weedon, UK",1836335569
1142,https://www.kickstarter.com/projects/cthulhuteapot/the-cthulhu-teapot-project?ref=discovery_popular,The Cthulhu teapot project,Beautiful handmade Chtulhu inspired tea or coffee set for everyday use. Made from high quality porcelain with love and passion.,Ceramics,"Las Vegas, NV",885161458
1143,https://www.kickstarter.com/projects/zoonchez/today-is-tomorrows-yesterday?ref=discovery_popular,Today is Tomorrow’s Yesterday,Not your usual diary. 28 arty sketchbooks in one book,Art,"Badalona, Spain",284321085
1144,https://www.kickstarter.com/projects/kartenspiel-auruxxx/kartenspiel-auruxxx-die-goldene-12?ref=discovery_popular,Kartenspiel AURUXXX Die Goldene 12,"Klassisches Kartenspiel. Spannend. Überraschend. Spielspaß für die ganze Familie. 160 Spielkarten, 1 Spielfigur ""Happy-Man"" und 1 Block",Tabletop Games,"Taunusstein, Germany",1771784260
1145,https://www.kickstarter.com/projects/challengers/keep-reading-comics-t-shirt-designed-by-gene-ha?ref=discovery_popular,"""Keep Reading Comics"" T-Shirt Designed by GENE HA",A t-shirt designed by comics superstar Gene Ha to celebrate the joy of comic books during this global pandemic.,Apparel,"Chicago, IL",959632288
1146,https://www.kickstarter.com/projects/pandoramonstera/panda-party-pins?ref=discovery_popular,Panda Party Pins,"Hard enamel pins of all the cute pandas! Giant panda, red panda, and trash panda are here for you to take them home.",Art,"Olympia, WA",880311150
1147,https://www.kickstarter.com/projects/gustave-et-cie/moon-phase-and-single-hand-watch-made-in-france?ref=discovery_popular,MOON-PHASE & SINGLE-HAND WATCH - Made in France,Do you know how the moon influences you ?,Product Design,"Paris, France",1510724455
1148,https://www.kickstarter.com/projects/lighthouse-issue-1/lighthouse-issue-1?ref=discovery_popular,Lighthouse Issue #1,Adapting an exciting Danish fantasy novel into a manga!,Graphic Novels,"Copenhagen, Denmark",1221201797
1149,https://www.kickstarter.com/projects/623970416/escape-game-la-legende-de-rohir?ref=discovery_popular,Escape game - La Légende de Rohir,Une salle d'escape game avec comédiens pour adultes et enfants!,Games,"Nantes, France",1126828529
1150,https://www.kickstarter.com/projects/twobroadscider/tasting-room-and-patio-at-two-broads-ciderworks?ref=discovery_popular,CIDER+PLACE: Tasting Room and Patio at Two Broads Ciderworks,"Social distancing is not forever, and when it's safe, Two Broads will have a place for the mixing of community, art, and culture.",Drinks,"San Luis Obispo, CA",533537066
1151,https://www.kickstarter.com/projects/inseazndesign/bells-and-pop-culture-an-animal-crossing-enamel-pin-series?ref=discovery_popular,Bells & Pop Culture - An Animal Crossing Enamel Pin Series,"An Animal Crossing inspired enamel pin set featuring a fusion of bells, pop culture, and Tom Nook.",Art,"San Francisco, CA",1198577436
1152,https://www.kickstarter.com/projects/darlingaslan/dino-fun-time-t-shirts-by-darling-aslan?ref=discovery_popular,Dino Fun Time t-shirts by Darling Aslan,Kawaii pastel dino tees!,Apparel,"Brighton, UK",846558620
1153,https://www.kickstarter.com/projects/abduction/abduction-0?ref=discovery_popular,ABDUCTION,A late 80's alien abduction short film,Shorts,"North Bay, Canada",1307306933
1154,https://www.kickstarter.com/projects/eyeah/eyeah-the-contact-case-with-a-solution?ref=discovery_popular,EYEAH: The Contact Case with a Solution,"Empowering you with an effortless eye care routine – Just fill, squeeze, and replenish the L and R caps with contact lens solution!",Product Design,"Little Rock, AR",1652225435
1155,https://www.kickstarter.com/projects/hempfacemasks/patent-pending-multilayered-hemp-face-mask-washable-reusable?ref=discovery_popular,Patent Pending Multilayered Hemp Face Mask Washable/Reusable,Patent Pending Multilayered Hemp Face Mask for Humans and Animals. When wet provides extra protection. Hemp Face Masks for all Seasons,Ready-to-wear,"Eugene, OR",1792137610
1156,https://www.kickstarter.com/projects/creativestudioinc/tamboo-towels?ref=discovery_popular,Tamboo Towels,A Multi-Purpose Towel Made From Bamboo,Product Design,"Toronto, Canada",1084017950
1157,https://www.kickstarter.com/projects/1lockeddowngardener/the-locked-down-gardener?ref=discovery_popular,The Locked Down Gardener,A memento and record of a pictorial pandemic gardening journal. A journey of building a garden from a blank canvas in a time of crisis.,Anthologies,"Roscrea, Ireland",1415433873
1158,https://www.kickstarter.com/projects/coffeehouse29/re-opening-coffee-house-29?ref=discovery_popular,Re-Opening Coffee House 29,Help Us Keep Coffee House 29 Alive,Drinks,"Windsor, CO",2065916926
1159,https://www.kickstarter.com/projects/stephaniejwomack/synkbib-the-stylish-sink-cover?ref=discovery_popular,SYNKBIB - The Stylish Sink Cover,"Your hair is your crowning glory, but it doesn't have to be all over your sink!",Product Design,"Chicago, IL",1904952453
1160,https://www.kickstarter.com/projects/cybergirlleeta6/cyber-girl-leeta-new-adventure-issue-6?ref=discovery_popular,Cyber Girl Leeta new adventure issue 6,"Cyber Girl Leeta new adventure, issue 6",Comics,"New Brunswick, NJ",41497009
1161,https://www.kickstarter.com/projects/lucadellolio/sostieni-anche-tu-quasaridioma?ref=discovery_popular,Sostieni anche tu Quasaridioma! Support Quasaridioma vinyl,Stampa di una tiratura limitata di 500 copie del mio album in vinile// Printing 500 vinyl copies of my latest album,Indie Rock,"Torino, Italy",1855124373
1162,https://www.kickstarter.com/projects/miguelmolinaart/minimalist-hero-and-villain-portraits?ref=discovery_popular,Minimalist Hero and Villain Portraits,Limited edition silkscreen portraits of some of your favourite super heroes and super villains.,Comics,"Vancouver, Canada",930473787
1163,https://www.kickstarter.com/projects/experiencenature/experience-nature-and-good-food?ref=discovery_popular,Experience Nature and Good Food,"An outdoor cookbook for food lovers and adventure seekers. For every book, we'll plant one tree with a reforestation project.🌲",Cookbooks,"Meran, Italy",1647851823
1164,https://www.kickstarter.com/projects/oldroydgames/confabulation?ref=discovery_popular,Confabulation,"A new word game combining elements of word-search, word-assembly, and category-based word games.",Tabletop Games,"Provo, UT",866646307
1165,https://www.kickstarter.com/projects/amoon/high-schoolers-for-front-liners?ref=discovery_popular,High Schoolers for Front Liners,High school students making homemade masks to help out frontline responders during the coronavirus outbreak.,Crafts,"Potomac, MD",2040205073
1166,https://www.kickstarter.com/projects/pickletoez/succulent-skull-patches?ref=discovery_popular,Succulent Skull Patches,Embroidered patches containing two of your favorite things: Skulls & Succulents.,Art,"Edmonton, Canada",1184180275
1167,https://www.kickstarter.com/projects/resinlab/heresylab-miniature-printable-files-stl-format?ref=discovery_popular,HeresyLab - Miniature Printable files - STL format,HeresyLab - Miniature Printable files in STL format only digital.,Tabletop Games,"Vicenza, Italy",790897103
1168,https://www.kickstarter.com/projects/thelearningforge/creatures-of-folklore-and-legends?ref=discovery_popular,Creatures of Folklore and Legends,Monthly Mail Subscription Box for Cryptid Fans,Art,"Orlando, FL",1419904058
1169,https://www.kickstarter.com/projects/sophiepf/silent-ocean?ref=discovery_popular,Silent Ocean,"A mermaid saves someone from drowning, only to let curiosity get the better of her.",Graphic Novels,"Dresden, Germany",106237464
1170,https://www.kickstarter.com/projects/solarminds/her-spirit-cracked-the-sky-vinyl-album-by-solarminds?ref=discovery_popular,"Her Spirit Cracked the Sky, vinyl album by solarminds","I'm raising $4,200 (or more) by my 42nd birthday for mastering, and producing vinyl copies, of the 42 min album. Pledges @ $42 & $420",Music,"Berkeley, CA",1922589551
1171,https://www.kickstarter.com/projects/mmleroynguon/a-world-of-sharing-your-one-year-journal-to-reboot?ref=discovery_popular,A World of Sharing - Your one-year journal to reboot,A real actionable journal that will guide you to achieve not just a good deed but a Great Awesome Deed every week for a whole year!,Publishing,"Luxembourg City, Luxembourg",1528475214
1172,https://www.kickstarter.com/projects/elforito3pesos/salvaalforito3pesos?ref=discovery_popular,#SalvaAlForito3pesos,Rehabilitación y construcción de 3 salas de microteatro y la conservación de un empleo seguro y estable para 10 personas.,Spaces,"Queretaro, Mexico",1176672618
1173,https://www.kickstarter.com/projects/kurtzauer/spectress-and-sabanion-1-a-supernatural-horror-hero-series?ref=discovery_popular,Spectress & Sabanion #1 - A Supernatural Horror/Hero Series,The ghost of Cleopatra's top assassin seeks to rejoin the living world and find purpose. Her journey begins with the demon Sabanion.,Comic Books,"Chicago, IL",21991528
1174,https://www.kickstarter.com/projects/jacobcsonka/indignity-0?ref=discovery_popular,indignity!,Thousands of Dare Combinations and Challenges! Only one will win!,Tabletop Games,"South Tampa, FL",165854712
1175,https://www.kickstarter.com/projects/drkmatt3rstudio/all-seeing-eye-enamel-pin-collection?ref=discovery_popular,All Seeing Eye Enamel Pin Collection,A collection of soft enamel pins by Dark Matter Studio,Art,"Wayne, MI",1030539556
1176,https://www.kickstarter.com/projects/myre/partners-collection?ref=discovery_popular,Partners Collection,Des pins inspirés des partenaires de nos héros préférés.,Accessories,"Meaux, France",1465232896
1177,https://www.kickstarter.com/projects/303996936/zesa-wireless-charging-reciever?ref=discovery_popular,ZESA - Wireless Charging Reciever,Upgrade your device smart and easily,Hardware,"Hong Kong, Hong Kong",955409996
1178,https://www.kickstarter.com/projects/drkmatt3rstudio/all-seeing-eye-enamel-pin-collection?ref=discovery_popular,All Seeing Eye Enamel Pin Collection,A collection of soft enamel pins by Dark Matter Studio,Art,"Wayne, MI",1030539556
1179,https://www.kickstarter.com/projects/forlagetpenge/den-lille-guide-til-opsparing?ref=discovery_popular,Den lille guide til opsparing,Få et fantastisk forhold til din privatøkonomi med denne lille guide,Nonfiction,"Copenhagen, Denmark",1904568402
1180,https://www.kickstarter.com/projects/thehemplog/the-hemp-log?ref=discovery_popular,The Hemp Log,Earth's Coolest Carbon-Negative Fire Log!,Design,"Irvine, CA",1340376351
1181,https://www.kickstarter.com/projects/creativecomicsstudio/vikings-vs-barbarians-action-figures?ref=discovery_popular,Vikings vs Barbarians Action Figures,"Viking and Barbarian 6"" scale fully poseable collectible action figures, weapon packs, posters and more. Shipping International Also.",Toys,"Ashley, PA",1853143507
1182,https://www.kickstarter.com/projects/artofgarymorgan/art-of-gary-morgan?ref=discovery_popular,Art of Gary Morgan,An art book collection,Illustration,"Pittsburgh, PA",1595087640
1183,https://www.kickstarter.com/projects/vanalrik/despot-science-fiction-and-fantasy-anthology?ref=discovery_popular,DESPOT Science Fiction & Fantasy Anthology,An anthology of short stories matched by a computer algorithm to classic science fiction and fantasy stories and Hugo Award winners,Fiction,"Salt Lake City, UT",1000378344
1184,https://www.kickstarter.com/projects/bcgoods/wanderlust-fulfilled?ref=discovery_popular,Wanderlust Fulfilled,A collection of original vintage style travel posters.,Art,"Los Angeles, CA",349692297
1185,https://www.kickstarter.com/projects/louisdebelle/cartographies-a-conceptual-street-photography-book?ref=discovery_popular,Cartographies – A Conceptual Street Photography Book,"A large format artist book about people's bodies, photographed in the streets of New York.",Photobooks,"Milano, Italy",605847576
1186,https://www.kickstarter.com/projects/stonesoupmedia/talk-with-your-mouth-full?ref=discovery_popular,Talk With Your Mouth Full,Break bread with a Syrian vegan and Jewish omnivore as they gather strangers and immigrant chefs to heal the world one table at a time.,Webseries,"Atlanta, GA",744341284
1187,https://www.kickstarter.com/projects/naomipacifique/after-a-room?ref=discovery_popular,after a room,A short film in which two people rediscover their bedroom together. Shot in March 2020 in Amsterdam. Currently in post-production.,Drama,"London, UK",633366269
1188,https://www.kickstarter.com/projects/naomipacifique/after-a-room?ref=discovery_popular,after a room,A short film in which two people rediscover their bedroom together. Shot in March 2020 in Amsterdam. Currently in post-production.,Drama,"London, UK",633366269
1189,https://www.kickstarter.com/projects/haliefewkes/macho-and-the-great-dragon-escape?ref=discovery_popular,Macho and The Great Dragon Escape!,A 28 page picture-book about the puppy who accidentally let all the baby dragons escape from the hatchery!,Children's Books,"Seattle, WA",1210015309
1190,https://www.kickstarter.com/projects/odpods/environment-burial-solution?ref=discovery_popular,Environment Burial Solution,Environmentally friendly Burial Solution,Hardware,"Sydney, AU",415928711
1191,https://www.kickstarter.com/projects/tandemboogie/inflatable-bodyboard-for-two-people-by-tandem-boogie?ref=discovery_popular,Inflatable Bodyboard for Two People by Tandem Boogie,The Tandem Boogie™ Board's unique design allows two people to catch and ride waves together regardless of skill or ability.,Product Design,"San Clemente, CA",522622447
1192,https://www.kickstarter.com/projects/bintongue/bintongue?ref=discovery_popular,Bintongue,An Indonesian language card game for Bali travellers.,Playing Cards,"Geelong, AU",882763860
1193,https://www.kickstarter.com/projects/bainsdesoleil/bains-de-soleil?ref=discovery_popular,BAINS DE SOLEIL,"Eco-friendly sandals for Men & Women handcrafted in France & Spain from recycled materials. (Tire, leather & cork)",Footwear,"Nice, France",1556808398
1194,https://www.kickstarter.com/projects/jest-tees/jest-tees-t-shirts-with-an-edge-needs-a-garment-printer?ref=discovery_popular,"Jest-Tees, t-shirts with an edge! Needs a garment printer","Funny t-shirts with an edge! Coming Soon, Made to Order Custom Shirts!",Fashion,"Boynton Beach, FL",661955484
1195,https://www.kickstarter.com/projects/arenaplayingcards/arena-playing-cards-arena-naipes?ref=discovery_popular,ARENA Playing Cards,"A deck of playing cards with an elegant and modern design, regarding the concept of time.",Playing Cards,"Madrid, Spain",666816918
1196,https://www.kickstarter.com/projects/myfriendlizzy/doodles-to-pins-set-1-cute-n-fun?ref=discovery_popular,"Doodles-to-Pins Set #1 ""Cute n' Fun""",Enamel Pins and MORE!,Digital Art,"Auburn, CA",1743486166
1197,https://www.kickstarter.com/projects/beverlysnyc/beverlys-so-we-can-see-you-soon?ref=discovery_popular,BEVERLY'S - So We Can See You Soon,"Help Beverly's get through this time, and to have the resources to adapt to this new climate - so that we can reopen and serve you.",Social Practice,"Lower East Side, NY",1604408908
1198,https://www.kickstarter.com/projects/miyukikomocha/hanami-festival-notifications-deluxe-edition?ref=discovery_popular,Hanami Festival (Notifications) - Deluxe Edition *:･ﾟ✧,"We got the Hanami Notifications into Enamel Pins! Now extending onto Washi Tapes and Acrylic Charms, to complete the festival!",Conceptual Art,"Oslo, Norway",955061911
1199,https://www.kickstarter.com/projects/kichnbleus/kich-and-bleus-comics-issue-1?ref=discovery_popular,Kich & Bleus Comics - Issue #1,Kich & Bleus #1 is a full-colored 18-page comic book about the main characters Kich and Bleus and the adventures they get into.,Comic Books,"Los Angeles, CA",1779996184
1200,https://www.kickstarter.com/projects/devnenski/floor-and-wall-carpet-design-from-digital-artwork?ref=discovery_popular,Floor and wall carpet design from digital artwork,"The idea behind this project is to create custom designed wall/floor carpets, rugs and other textile covering, based on my digital art.",Digital Art,"Valencia, Spain",204480301
1201,https://www.kickstarter.com/projects/reformedalloy/electrum-a-tabletop-game-companion?ref=discovery_popular,Electrum: A Tabletop Game Companion,"A set of modular tabletop game visualization and management tools, particularly designed for D&D 5th Edition.",Tabletop Games,"Winston-Salem, NC",585234746
1202,https://www.kickstarter.com/projects/emmawoodthorpe/our-dave-a-rhyming-childrens-picture-book?ref=discovery_popular,Our Dave: A Rhyming Children's Picture Book,A beautifully illustrated rhyming children's picture book about a cat who battles loneliness to find belonging in his forever home.,Children's Books,"Sheffield, UK",1433411596
1203,https://www.kickstarter.com/projects/numptygames/numpty?ref=discovery_popular,Numpty,Strategic card game where you climb the corporate ladder by throwing your friends under the bus!,Tabletop Games,"Wellington, NZ",1321562197
1204,https://www.kickstarter.com/projects/backmasterpro/backmagicwheelstm?ref=discovery_popular,BackMagicWheels™,THE BEST REPLACEMENT FOR WARM MASSAGING MAGIC HANDS!,Technology,"Newport Beach, CA",559118629
1205,https://www.kickstarter.com/projects/fairyspupil/starry-universe-dice-d20-dnd?ref=discovery_popular,Starry universe dice D20 DND ~Early Bird~,Fairy's Pupil Starry universe dice DnD 7 Pieces / Set D20 TRPG RPG Game,Tabletop Games,"Central, Hong Kong",4838994
1206,https://www.kickstarter.com/projects/pim/el-retro-playing-cards?ref=discovery_popular,El Retro Playing Cards,With the DNA of old school Vegas culture we created El Retro as a tribute to the land of $1 cocktails and $5 Blackjack. Printed @ USPCC,Playing Cards,"Los Angeles, CA",153531370
1207,https://www.kickstarter.com/projects/dimitriarnauts/sea-storm-for-real?ref=discovery_popular,"Sea Storm, for real...","Recording a new symphonic poem, part of a suite evoking splendid & marvelous landscapes and ecosystems of our endangered planet Earth !",Classical Music,"Brussels, Belgium",883868368
1208,https://www.kickstarter.com/projects/fabstudios/lgbtq-controller-enamel-gaymer-pins-series-i?ref=discovery_popular,LGBTQ+ Controller: Enamel Gaymer Pins Series I,Fab Unicorn Studios is a company I started to develop LGBTQ+ gaming products. I started with pins and want to complete the series.,Design,"Washington, DC",2011679403
