,url,title,description,category,location,project_id
549,https://www.kickstarter.com/projects/outlandent/warlock-5-omnibus-by-den-beauvais-and-gordon-derry?ref=discovery_popular,Warlock 5 Omnibus by Den Beauvais & Gordon Derry,A collected omnibus of the original Warlock 5 comic series from Den Beauvais and Gordon Derry + THE UNRELEASED ISSUES 14 & 15!,Graphic Novels,"Kansas City, MO",23202629
550,https://www.kickstarter.com/projects/jooray/jooray-shoe-size-isnt-everything?ref=discovery_popular,Jooray | Shoe Size Isn’t Everything,"The world’s first sneaker with AdapFit™ technology, boasting 5 AdaptPoints that easily tailor to your foot",Footwear,"New York, NY",2099223267
551,https://www.kickstarter.com/projects/infiniticlean/new-patented-infiniti-cleaner-leaves-swiffer-in-the-dust?ref=discovery_popular,"The Quick Cleaning Mop that is Easier, Faster, and Cleaner","Infiniti Clean Patented Cleaning Cartridge System™ ensures you never have to touch a dirty, wet pad again!",Product Design,"Mount Holly, NJ",1239913476
552,https://www.kickstarter.com/projects/happypiranha/rpg-adventure-gaming-candles?ref=discovery_popular,"Gaming Candles for Dungeons & Dragons, DnD & RPG Board Games","Scented Candles for Dungeons & Dragons, D&D 5e, Pathfinder RPG and Dungeon Masters. Role playing boardgame accessories by Happy Piranha",Gaming Hardware,"Truro, UK",26931741
553,https://www.kickstarter.com/projects/fairsparkbooks/the-spark-the-all-ages-sci-fi-comic-magazine?ref=discovery_popular,The Spark: The All-Ages Sci-Fi Comic Magazine,Get Issues 1-4 now and pre-order issue 5-8.,Comics,"London, UK",375055740
554,https://www.kickstarter.com/projects/lemeownade/animal-king-enamel-pins?ref=discovery_popular,"Eco ITA Bag (+ pin pad) 20+ Glitter, Spinning Enamel Pins","26 new hard enamel pins, ITA BAG, sticker & lanyard. A minimal everyday bag to carry/protect your essentials and display your flair.",Illustration,"Sydney, AU",417568834
555,https://www.kickstarter.com/projects/honeybourne/the-isolation-creations-2021-calendar?ref=discovery_popular,THE ISOLATION CREATIONS 2021 CALENDAR,"Two men locked up in Scarborough, UK, with too many wigs, big imaginations and a lot of time on their hands!",Calendars,"Scarborough, UK",873713203
556,https://www.kickstarter.com/projects/stardustscience/stardust-edition-go-extinct-evolutionary-tree-board-game?ref=discovery_popular,Stardust Edition Go Extinct!: Evolutionary Tree Board Game,A fun way to learn the concept of Darwin's evolutionary tree with the Stardust version of this award-winning science game!,Tabletop Games,"Sugarhouse, UT",568407541
557,https://www.kickstarter.com/projects/1750288757/backfire-automatic-watches?ref=discovery_popular,BackFire Automatic Watches,"BackFire watches integrate automobile’s transmission system, to create the super unique watch",Product Design,"Central, Hong Kong",1316796012
558,https://www.kickstarter.com/projects/joshuaessoe/action-sequences-and-sex-scenes?ref=discovery_popular,Essoe's Guides to Writing: Action Sequences & Sex Scenes!,"The first in a five-book series, each covering two subjects of the most-common issues I see in fiction writing as a full-time editor.",Nonfiction,"Baltimore, MD",2081743083
559,https://www.kickstarter.com/projects/anadiachan/chasing-stars-fantasy-comic-issue-1?ref=discovery_popular,Chasing Stars Fantasy Comic Issue #1,An epic fantasy featuring Emery Moon as Asteria's #1 wanted thief. It's Aston's job as an aspiring knight to catch the elusive criminal,Comics,"Klamath Falls, OR",1436889076
560,https://www.kickstarter.com/projects/brantfowler/the-last-ember-1-reforged-mythology-magic-and-mystery?ref=discovery_popular,"The Last Ember #1: Reforged - Mythology, Magic & Mystery","Ember, the last fire goddess must protect her loved ones and avoid school bullies while being hunted by forces bent on her destruction.",Comic Books,"Tyler, TX",1345315784
561,https://www.kickstarter.com/projects/nomnomnyan/standing-strong-enamel-pin-series-inspired-by-women-writers?ref=discovery_popular,Standing Strong- Enamel Pin Series Inspired by Women Writers,Hard enamel pins featuring designs inspired by and quotes from women writers!,Art,"Princeton, NJ",1347064876
562,https://www.kickstarter.com/projects/strathtarot/the-strath-tarot?ref=discovery_popular,The Strath Tarot Deck,"The Majors, reimagined. A 22 card Major Arcana deck that dives deep.",Illustration,"Kamiah, ID",331352984
563,https://www.kickstarter.com/projects/selinafenech/emotionally-charged-ya-superhero-audiobook?ref=discovery_popular,Emotionally Charged: YA Superhero Audiobook,"Creating audiobooks for the young adult superhero series, The Empath Chronicles by S.A. Fenech",Fiction,"Gosford, AU",32546212
564,https://www.kickstarter.com/projects/littlethingslive/where-all-the-little-things-live?ref=discovery_popular,Where All the Little Things Live,"A new young reader's book and audiobook by Ian Tadashi Moore, author of Zōsan and Tamaishi.",Children's Books,"Canton, MI",1317542880
565,https://www.kickstarter.com/projects/go-ring3/go-fast-keyring-makes-changing-keys-easy?ref=discovery_popular,GO Keyring - Change Keys FAST & Save your Fingernails!,"Strong, Secure, Modern, and Minimal, Grade 5 Titanium Fast Clip Keyring, EDC",Product Design,"Huntington Beach, CA",1662555113
566,https://www.kickstarter.com/projects/nexshotpro/nexshot-pro-short-game-on?ref=discovery_popular,NEXShot Pro | Short Game On,Improve all aspects of your short game from home with NEXShot Pro,Product Design,"Elgin, IL",693149854
567,https://www.kickstarter.com/projects/bestoutof5/chronoconflict?ref=discovery_popular,ChronoConflict: The Card Game,Indie card game for two players that puts you in the shoes of time travelling assassins or those who would try to stop them.,Tabletop Games,"Reading, UK",534534516
568,https://www.kickstarter.com/projects/blushingblu/flexibility-love-trust-hard-enamel-pins?ref=discovery_popular,"Flexibility, Love, + Trust Hard Enamel Pins",A set of hard enamel pins inspired from Steven Universe.,Accessories,"Fort Pierce, FL",460966373
569,https://www.kickstarter.com/projects/anayagues/brazilian-jiu-jitsu-the-rules-of-the-game?ref=discovery_popular,Brazilian Jiu Jitsu - The Rules of the Game,A children's book dedicated to teaching the rules and terms of Brazilian Jiu Jitsu to kids of all ages.,Children's Books,"Hamburg, Germany",512217187
570,https://www.kickstarter.com/projects/maikopins/magical-cross-over-ita-bag?ref=discovery_popular,Magical Cross-over ita bag!,Maikopins creating ITA BAG!,Art,"Singapore, Singapore",1591584152
571,https://www.kickstarter.com/projects/tcssoulmate/the-corrupting-sea-soul-mate?ref=discovery_popular,"The Corrupting Sea: ""Soul Mate""","A high quality vinyl version of The Corrupting Sea's 12th album ""Soul Mate"".",Electronic Music,"Shelbyville, KY",2098199506
572,https://www.kickstarter.com/projects/gametimeagain/upkeep-0?ref=discovery_popular,Upkeep,An interactive game for 1-4 people where players race to recover their yard from the crazy autumn weather.,Tabletop Games,"Cambridge, NZ",718313491
573,https://www.kickstarter.com/projects/polliadesign/board-game-genre-enamel-pins?ref=discovery_popular,Board Game Genre Enamel Pins,A mega-set of enamel pins featuring favorite board game genres and mechanics for tabletop gamers!,Tabletop Games,"Pittsburgh, PA",1646251333
574,https://www.kickstarter.com/projects/pandorasboxcardgame/pandoras-box-card-game-laughter-chaos-and-strategy?ref=discovery_popular,"Pandora's Box Card Game - Laughter, Chaos, and Strategy!","Game Night just got better. The fast-paced, high-energy strategic card game fit for the Gods.",Tabletop Games,"Mount Olympus Cove, UT",250807251
575,https://www.kickstarter.com/projects/clarahoppe/the-instant-nudes-photobook?ref=discovery_popular,The Instant Nudes Photobook,Instant Nudes is a photo book dedicated to erotic instant photography by about 20 photographers.,Photobooks,"Dortmund, Germany",1990218937
576,https://www.kickstarter.com/projects/nihilismdeck/circlegame-playing-cards?ref=discovery_popular,Circlegame Playing Cards,Keep it Simple. Make it Real.,Playing Cards,"Tokyo, Japan",932781904
577,https://www.kickstarter.com/projects/hypemonsta/mermay-2020-a-designer-pin-collection?ref=discovery_popular,Mermay 2020 - A Designer Pin Collection,Enamel Pins designed by 6 top Instagram artists.,Art,"Melbourne, AU",2132033865
578,https://www.kickstarter.com/projects/alius/alius-the-worlds-first-desktop-cnc-vertical-mill?ref=discovery_popular,"ALIUS, The worlds first desktop CNC vertical Mill","ALIUS, The worlds first desktop CNC vertical Mill, boasting high precision, active vibration damping, flood coolant, air blast ...",Makerspaces,"Auckland, NZ",622422362
579,https://www.kickstarter.com/projects/horatorastudios/demon-bitch-the-i-told-you-so-campaign?ref=discovery_popular,"Demon Bitch: The ""I Told You SO!"" Campaign",Demon Bitch's Shitty Tarot - Except that it's a Lenormand deck with a few oracle cards. That's because she's stupid. Bad luck are go!!!,Illustration,"Los Angeles, CA",420418003
580,https://www.kickstarter.com/projects/tiiga/tiiga-natures-hydration?ref=discovery_popular,Tiiga: Nature's Hydration,Baobab Electrolyte Drink Mix - Made with Real Fruit as its First Ingredient,Drinks,"Lincoln, NE",921926723
581,https://www.kickstarter.com/projects/atosaccessories/cute-washi-tapes?ref=discovery_popular,Cute Washi Tapes! NEW STRETCH GOALS ADDED!,A series of cute and magical washi tape including gold & holographic foil tape! These are all inspired by recent illustrations.,Illustration,"Hampshire, UK",1681583460
582,https://www.kickstarter.com/projects/formel-fun/formel-fun-car-racing-with-cards?ref=discovery_popular,FORMEL FUN - car racing with cards,FORMEL FUN is a crazy car race. The cars are driven with cards. Each player uses his own deck of cards.,Tabletop Games,"Lichtenau, Germany",1605159886
583,https://www.kickstarter.com/projects/eduonix/cloud-computing-e-degree?ref=discovery_popular,Cloud Computing E-Degree,"Become a Cloud Computing Professional and master the concepts of Computation, Container, Storage and Database services and more.",Web,"Orlando, FL",587701711
584,https://www.kickstarter.com/projects/hss/cultivation-kit-to-save-the-world-nyoki?ref=discovery_popular,"Cultivation Kit to Save The World ""NYOKI""",NYOKI is a cultivation kit that anyone can easily enjoy harvesting various plants just with a plastic bottle of water.,Product Design,"Tokyo, Japan",1115437077
585,https://www.kickstarter.com/projects/1848628223/knights-of-the-chalice-2-revolutionise-old-school-crpgs?ref=discovery_popular,Knights of the Chalice 2: Revolutionise Old-School CRPGs!,"Party-based CRPG using the OGL 3.5 ruleset. Features turn-based combat, emergent AI, 2D graphics and a powerful innovative toolset.",Video Games,"Burnley, UK",947609585
586,https://www.kickstarter.com/projects/losttrilogy/the-sagas-of-noggin-the-nog-the-lost-trilogy-expansion?ref=discovery_popular,The Sagas of Noggin the Nog. The Lost Trilogy Expansion,"A small promo expansion for the boardgame, 'Tales of the Northlands'",Tabletop Games,"Epsom, UK",1334037853
587,https://www.kickstarter.com/projects/timetosser/timetosser-presented-by-alteraudio?ref=discovery_popular,Timetosser presented by alter.audio,"""The standalone instrument for re-sequencing audio on the fly.""",Sound,"Utrecht, Netherlands",1425947003
588,https://www.kickstarter.com/projects/hooligansco/faros-american-safari-massachusetts-edition-witches?ref=discovery_popular,Faro's American Safari -- MASSACHUSETTS EDITION -- Witches +,"Massachusetts calls 4 Massive Witches + Mutants in Metal Bikinis, Asgardian Judges & Scarface vs Thunderlips -- The American Safari,",Anthologies,"Lake Worth, FL",753938291
589,https://www.kickstarter.com/projects/jessicamaya/wild-west-themed-playing-cards-leather-pattern?ref=discovery_popular,Western Leather - Leather pattern gilded playing cards,Beautifully designed leather pattern playing cards with wild west theme,Playing Cards,"San Francisco, CA",629820164
590,https://www.kickstarter.com/projects/returntosender1/return-to-sender-issue-one?ref=discovery_popular,Return to Sender - Issue One,"Return to Sender is a western supernatural horror comic book with a bit of detective work thrown in for good measure,",Comic Books,"Tampa, FL",1634658510
591,https://www.kickstarter.com/projects/1451475383/extended-ergonomic-footrest?ref=discovery_popular,Extended Ergonomic Footrest,Enjoy comfortably working at your desk as our footrest takes pressure off of your lower back. Its long length makes it suitable for all,Design,"Ottawa, Canada",1359543
592,https://www.kickstarter.com/projects/brettweissnes1/nes-omnibus-vol-1-a-l-deluxe-hardcover-nintendo-book?ref=discovery_popular,NES Omnibus Vol. 1 (A-L) - Deluxe Hardcover Nintendo Book,"NES Omnibus: The Nintendo Entertainment System and Its Games, Vol. 1 (A–L) Gorgeous Hardcover Book - Every Game Gets 1 - 2 Full Pages!",Nonfiction,"Fort Worth, TX",1173829277
593,https://www.kickstarter.com/projects/ghostislandcomic/ghost-island-1-6-the-complete-collection?ref=discovery_popular,Ghost Island #1 - #6 A supernatural Horror series,Dubbed as “Jurassic Park but with Ghosts.” The series concludes as the truth is unlocked.,Comics,"Liverpool, UK",1350121944
594,https://www.kickstarter.com/projects/sabrewolf/jane-austens-revenge?ref=discovery_popular,Jane Austen's Revenge,A deliciously wicked expansion for Jane Austen's Matchmaker: Chapter Two.,Tabletop Games,"Lincoln, UK",1393341174
595,https://www.kickstarter.com/projects/atthisarts/littlebird?ref=discovery_popular,Little Hummingbird Hard Enamel Pins,"Colorful, sweet, hummingbird pins to support a small indie press",Accessories,"Detroit, MI",1961942410
596,https://www.kickstarter.com/projects/lattelover/love-is-war-pin-set?ref=discovery_popular,Love is War Pin Set,A fan art pin set of Kaguya-sama Love is War.,Mixed Media,"Tokyo, Japan",355178125
597,https://www.kickstarter.com/projects/alexmaklai/sea-of-nadia-0?ref=discovery_popular,SEA OF NADIA,"Uncover Treasure, smuggle goods, convert resources, and be the best pirate in the Sea of Nadia.",Tabletop Games,"Los Angeles, CA",58777958
598,https://www.kickstarter.com/projects/lmt/totem-by-let-me-think-turn-your-phone-into-a-work-tool?ref=discovery_popular,Totem by Let Me Think – Turn your phone into a work tool,"With the Totem, get a phone for work inside your phone. Focus better. Don't fear of missing out.",Apps,"Paris, France",639072816
599,https://www.kickstarter.com/projects/1610326087/masons-paradox-0?ref=discovery_popular,Masons Paradox,"An animated series called Mason's Paradox, which follows Mason & friends on their quest to uncover the secrets & dangers of the cosmos.",Animation,"Los Angeles, CA",1658232651
600,https://www.kickstarter.com/projects/disasterinc/el-rey-comics-2-new-variants-by-by-peach-momoko?ref=discovery_popular,El Rey Comics: 2 New Variants by Peach Momoko,A series of variant covers designed by Peach Momoko from Aftershock Comics and El Rey Comics,Comic Books,"Portland, ME",90754949
601,https://www.kickstarter.com/projects/formation-cradistry/formation-cardistry-cards?ref=discovery_popular,Formation Cardistry Cards,Formed as a tool for cardistry. Designed in the UK. Shipping world wide.,Games,"Cheltenham, UK",486484022
602,https://www.kickstarter.com/projects/688409763/creative-clout-hard-enamel-pin-collection?ref=discovery_popular,Creative Clout Hard Enamel Pin Collection,Design humor for graphic designers and digital artists in enamel pin form!,Accessories,"Honolulu, HI",1301036994
603,https://www.kickstarter.com/projects/drewcifer/the-epic-of-dreams-rpg-basilisk-edition?ref=discovery_popular,The Epic of Dreams RPG: Basilisk Edition,A Unique RPG designed for the Pinnacle Immersive Role-Play Experience.,Tabletop Games,"Rochester, NY",1094489060
604,https://www.kickstarter.com/projects/novelmenagerie/the-bookish-habits-enamel-pin-set-by-the-novel-menagerie?ref=discovery_popular,The Bookish Habits Enamel Pin Set by The Novel Menagerie,A collection of glittery book themed enamel pins based on my favourite reading habits!,Illustration,"Edinburgh, UK",1618577963
605,https://www.kickstarter.com/projects/gofightfantastic/go-fight-fantastic-3-player-action-adventure?ref=discovery_popular,Go Fight Fantastic! - Hand Drawn Action-RPG for 1-3 players,"A super vibrant Action-RPG for 1-3 player where each character has a unique set of skills, featuring both online and local multiplayer!",Video Games,"Stockholm, Sweden",1482717482
606,https://www.kickstarter.com/projects/598293826/mythological-monsters-and-scenery-3d-printable-stl-miniatures?ref=discovery_popular,"Mythological Monsters & Scenery, 3D Printable STL Miniatures","Dragons, Unicorns and More! A Collection of Mythological Beasts & Props for You to Print at Home!",Tabletop Games,"Munich, Germany",1572344790
607,https://www.kickstarter.com/projects/lunakoradesigns/cryptid-cuties-and-friends-pride-ename-pins?ref=discovery_popular,♥ Cryptid Cuties & Friends Pride Ename Pins ♥,"Hard enamel pins featuring your favorite cryptid cuties, their friends and LGBT Pride flag - LIFE GETS BETTER TOGETHER!",Illustration,"Clarksburg, WV",396023321
608,https://www.kickstarter.com/projects/kairui/my-cat-is-a-wizard-volume-1?ref=discovery_popular,My Cat is a Wizard Volume 1,"Volume 1 of My Cat is a Wizard, an original webcomic adapted for print.",Webcomics,"Fond du Lac, WI",1053066876
609,https://www.kickstarter.com/projects/spineice/spine-ice-back-pain-relief?ref=discovery_popular,Spine Ice Back Pain Relief,...a lumbar support ice pack,Product Design,"Marlboro, NJ",1465471090
610,https://www.kickstarter.com/projects/palettepins/makeup-palette-pins?ref=discovery_popular,Makeup Palette Pins!,Pins from my Pokemon-inspired eyeshadow palettes series on my instagram,Product Design,"Santiago, Chile",388472572
611,https://www.kickstarter.com/projects/pocketjacks/white-lily-5-comic-main-issue-40-page-beautiful-color?ref=discovery_popular,White Lily #5 Comic Main Issue : 40 Page Beautiful Color,The final chapter of the story of the two deadliest female fighter pilots who ever lived. Nothing but positive customer feedback.,Comics,"Dallas, TX",1521470933
612,https://www.kickstarter.com/projects/paleopals/paleo-pals-primordial-pins-oakley-the-opabinia?ref=discovery_popular,Paleo Pals ® - Primordial Pins Oakley the Opabinia,Paleo Pals® are back with jumbo-sized enamel pins of our prehistoric fossil friends... add some science swag to your fieldwork bag!,Accessories,"Denver, CO",1987850104
613,https://www.kickstarter.com/projects/benjaminwurster/leafy-house-plants?ref=discovery_popular,Leafy House Plants: Reissue of a Botanical Encyclopedia,A coffee table book that will improve your desire to stay at home.,Publishing,"Stuttgart, Germany",706778673
614,https://www.kickstarter.com/projects/bakaturtle/cute-shrine-demon-hard-enamel-pins?ref=discovery_popular,Cute Shrine Demon Hard Enamel Pins by Bakaturtle,A Cute Pair of Shrine Demon Hard Enamel Pins,Product Design,"London, UK",1272046556
615,https://www.kickstarter.com/projects/overworldgames/good-cop-bad-cop-promoted?ref=discovery_popular,Good Cop Bad Cop: Promoted,An expansion to Good Cop Bad Cop where your cunning and heroics in one game get you promoted in the next.,Tabletop Games,"Los Angeles, CA",1964979578
616,https://www.kickstarter.com/projects/divak-sunglasses/dv?ref=discovery_popular,DIVAK: Eco-Friendly and Highly Durable Wooden Sunglasses,"Made of natural wood, DIVAKs are strong, handcrafted & uniquely stylish.",Accessories,"Sofia, Bulgaria",245115291
617,https://www.kickstarter.com/projects/american-beauty/american-beauty-1?ref=discovery_popular,American Beauty,The Opulent Pre-Depression Architecture of Detroit. A fine art photography book.,Photobooks,"Detroit, MI",1245457563
618,https://www.kickstarter.com/projects/aholmes9/project-trey-a-down-syndrome-awareness-music-video?ref=discovery_popular,Project Trey: A Down Syndrome Awareness Music Video,Help Trey make a music video to show the greatness in all of us.,Music Videos,"Salt Lake City, UT",1594062145
619,https://www.kickstarter.com/projects/gritcitycomics/heroes-need-masks-comic-anthology?ref=discovery_popular,HEROES NEED MASKS comic anthology,"Raising awareness to our healthcare workers during our COVID-19 pandemic with positive stories of hope, community and masks.",Anthologies,"Tacoma, WA",1498425025
620,https://www.kickstarter.com/projects/pistolpie/lbgtq-pride-animal-enamel-pins?ref=discovery_popular,LGBTQ+ Pride Animal Enamel Pins,A set of LGBTQ+ hard enamel pins featuring kawaii animal themes.,Accessories,"Austin, TX",2033913917
621,https://www.kickstarter.com/projects/fivegodsofkungfu/the-five-gods-of-kung-fu?ref=discovery_popular,The Five Gods Of Kung Fu,A 2D Beat'em Up with Fighting Game inspired controls,Video Games,"München, Germany",1278858216
622,https://www.kickstarter.com/projects/robinsnerdsupplies/talis-evolvere-metal-language-dice?ref=discovery_popular,"Talis Evolvere: Arabic, Kanji, & Thai Metal Dice Set","Metal dice sets in different languages for tabletop games, starting with Arabic, Kanji, and Thai",Tabletop Games,"Denver, CO",1398082519
623,https://www.kickstarter.com/projects/murrieberry/pastel-frog-oracle-deck?ref=discovery_popular,Pastel Frog Oracle Deck,20 adorable pastel frog themed oracle cards.,Illustration,"Houston, TX",1465582142
624,https://www.kickstarter.com/projects/maxl/the-rio-cinema-archive-book?ref=discovery_popular,The Rio Cinema Archive book,Radical Community Photography in Hackney in the '80s,Publishing,"Hackney, UK",64251710
625,https://www.kickstarter.com/projects/badbeavercomics/fallen-2-the-death-of-a-god-was-just-the-beginning?ref=discovery_popular,FALLEN #1-2: The Death of a God Was Just the Beginning,The thrilling mythological crime noir continues!,Comic Books,"Ottawa, Canada",1998490294
626,https://www.kickstarter.com/projects/thepoopstick/the-poopstick?ref=discovery_popular,The PoopSTICK,"A Compact, Adjustable device that will ease your poop.",Design,"San Antonio, TX",803962476
627,https://www.kickstarter.com/projects/rieindie/ise-and-kai-chosen-throne?ref=discovery_popular,Ise & Kai: Chosen Throne,An otome with an interesting spin on the popular isekai genre.,Video Games,"Vancouver, Canada",1945194456
628,https://www.kickstarter.com/projects/thecraftcoven/void-coven-stardust-nostalgia-consoles-hard-enamel-pin-set?ref=discovery_popular,Void Coven - Stardust Nostalgia Consoles Hard Enamel Pin Set,A collection of collaborative nostalgia themed hard enamel pins - Rose tinted and filled with stardust.,Accessories,"Northampton, UK",1910736408
629,https://www.kickstarter.com/projects/redhenpress/summer-of-the-cicadas?ref=discovery_popular,Summer of the Cicadas,Join Red Hen Press to Help Support Queer Literature/Nurture Queer Voices,Fiction,"Pasadena, CA",1044110693
630,https://www.kickstarter.com/projects/bonnieelizabeth/ash-jericho-to-die-for?ref=discovery_popular,Ash Jericho: To Die For,A trilogy of paranormal mysteries set in small town Kentucky featuring psychic Ash Jericho,Fiction,"Lexington, KY",1855851524
631,https://www.kickstarter.com/projects/bloomscience/homeschooling-playbooks-for-the-big-talks?ref=discovery_popular,HOMESCHOOLING PLAYBOOKS FOR THE BIG TALKS,"Modernizing sex-ed into the playful and inclusive conversation about empathy, safety, and biology that it always should have been.",Children's Books,"San Francisco, CA",1504595966
632,https://www.kickstarter.com/projects/b-create/b-create-online-symposium-2020?ref=discovery_popular,B. Create. Online Symposium 2020,"B. Create. is a creative hub for artists and community, hosting a symposium of 5 events on Saturdays from May 16-June 14. Come join!",Art,"Rutherford, NJ",60722704
633,https://www.kickstarter.com/projects/1925885552/sf3-0?ref=discovery_popular,SF3 #0,The introduction and origins to a new fantastic superhero squad.,Comic Books,"Newport News, VA",1605993044
634,https://www.kickstarter.com/projects/theagencysixcomic/the-agency-6?ref=discovery_popular,The Agency #1-6,As the world of magic is thrown into chaos; a mysterious group once thought to be myth will help Riley and our Agents.,Comic Books,"Tampa, FL",1196098734
635,https://www.kickstarter.com/projects/haylandgames/3d-printable-fantasy-scenery-4-0?ref=discovery_popular,3D Printable Fantasy Scenery # 4,"3D Printable Fantasy Scenery #4 - 3D Printable Fantasy Bones,Ruins and more! Funded in 40 Minutes! 6 Stretch Goals Unlocked!",Tabletop Games,"Nottingham, UK",1317296575
636,https://www.kickstarter.com/projects/gameload/yourstory?ref=discovery_popular,Your Story - a fantasy visual novel,Become a guide to Lia - a young half-elvish heroine of our fantasy medieval romance visual novel.,Video Games,"Krakow, Poland",24585739
637,https://www.kickstarter.com/projects/kalyssa/a-duck-in-water-20-enamel-pins?ref=discovery_popular,a duck in water 2.0 [enamel pins],"Enamel Pins Inspired by Kindness, History of Thinking, and Growth.",Jewelry,"Seattle, WA",1562164095
638,https://www.kickstarter.com/projects/thermion/thermion-zero-dinamic-hybrid-amplifier?ref=discovery_popular,Thermion Zero - Dynamic hybrid amplifier,A versatile hybrid guitar amplifier with reverb that fits your pedalboard.,Sound,"Albacete, Spain",947847804
639,https://www.kickstarter.com/projects/ww3/a-more-graceful-shaboom-lgbtq-kids-book?ref=discovery_popular,A MORE GRACEFUL SHABOOM– LGBTQ KIDS' BOOK,"A charming adventure story about a non-binary kid's escapades after discovering a magical purse, by Jacinta Bunnell & Crystal Vielula",Children's Books,"Oakland, CA",1048281628
640,https://www.kickstarter.com/projects/f-armybassorchestra/call-to-arms-0?ref=discovery_popular,Call to Arms,"Album d'esordio degli ""F-Army, a small electric bass orchestra"" _ Debut Album of the ""F-army, a small electric bass orchestra""_",Music,"Pescara, Italy",1428571283
